{"$schema":"https://json-schema.org/draft/2020-12/schema","$id":"https://raw.githubusercontent.com/mikelninh/openaction/main/spec/1.0/pilot-profile.schema.json","title":"OpenAction Bounded Pilot Profile 1.0 RC1","type":"object","additionalProperties":false,"required":["version","id","name","bounds","mandatory_controls","graduation"],"properties":{"version":{"const":"openaction-pilot/1.0-rc1"},"id":{"type":"string","pattern":"^oaprof_[A-Za-z0-9._-]+$"},"name":{"type":"string"},"bounds":{"type":"object","required":["environment","max_users","max_days","external_side_effects"],"properties":{"environment":{"enum":["sandbox","pilot"]},"max_users":{"type":"integer","minimum":1},"max_days":{"type":"integer","minimum":1},"data_classes":{"type":"array","items":{"enum":["synthetic","public","internal","personal","sensitive","highly_sensitive"]}},"external_side_effects":{"type":"boolean"},"autonomous_decisions":{"type":"boolean"},"allowed_integrations":{"type":"array","items":{"type":"string"}}}},"mandatory_controls":{"type":"array","items":{"type":"string"}},"required_gates":{"type":"array","items":{"type":"string"}},"graduation":{"type":"object","required":["success_metrics","stop_conditions"],"properties":{"success_metrics":{"type":"array","items":{"type":"string"}},"stop_conditions":{"type":"array","items":{"type":"string"}}}}}}