{"version":"openaction-pilot/1.0-rc1","id":"oaprof_safe_sandbox_v1","name":"Safe AI Sandbox v1","bounds":{"environment":"sandbox","max_users":25,"max_days":30,"data_classes":["synthetic","public","internal"],"external_side_effects":false,"autonomous_decisions":false,"allowed_integrations":["read-only mock adapters"]},"mandatory_controls":["named pilot owner","audit log","kill switch","no production credentials","human-visible outputs","documented stop conditions"],"required_gates":["purpose","security","governance"],"graduation":{"success_metrics":["task correctness","evidence traceability","user usefulness","zero unapproved side effects"],"stop_conditions":["unexpected data exposure","unapproved external action","critical factual error without escalation"]}}